{
  "build": {
    "build_type": null,
    "compiler": null,
    "rmw_implementation": null,
    "ros_distro": "humble"
  },
  "capture_backend": "cpp",
  "capture_quality": {
    "admitted": 57183,
    "ambiguous_topic_types": 0,
    "backend": "cpp",
    "best_effort_topics": 10,
    "bytes_captured": 59441046,
    "bytes_dropped": 0,
    "capture_ended_monotonic_ns": 488953654761,
    "capture_memory_budget_bytes": 33615940,
    "capture_started_monotonic_ns": 458563102269,
    "clean": true,
    "clock_anomalies": 0,
    "committed": 57183,
    "configured_memory_budget_bytes": 134217728,
    "delivery_scope": "callback_received",
    "drop_breakdown": [],
    "dropped": 0,
    "durable": 57183,
    "endpoint_query_failures": 0,
    "graph_coverage_faults": 0,
    "graph_scope": "configured",
    "graph_snapshot_failures": 0,
    "graph_wait_faults": 0,
    "incompatible_qos_events": 0,
    "monotonic_end_ns": 488882423004,
    "monotonic_start_ns": 458581346013,
    "node_coverage_truncated": false,
    "node_snapshot_failures": 0,
    "observed_host": "",
    "peak_queue_depth": 134,
    "queue_capacity": 4096,
    "received": 57183,
    "retained_bytes": 62313487,
    "retained_events": 57183,
    "retained_segments": 7,
    "retention_evicted_bytes": 0,
    "retention_evicted_events": 0,
    "retention_evicted_segments": 0,
    "retention_max_bytes": 2147483648,
    "retention_max_segments": 256,
    "rmw_event_callbacks_unavailable": 0,
    "rmw_messages_lost": 0,
    "role": "onboard",
    "runtime_callback_faults": 0,
    "schema_version": "blackboxrs.capture_quality.v1",
    "session_id": "1786248349666708775_33014",
    "storage_errors": 0,
    "subscription_failures": 0,
    "topic_coverage_truncated": false
  },
  "counters": {
    "admitted": 57183,
    "committed": 57183,
    "dropped": 0,
    "dropped_bytes": 0,
    "durable": 57183,
    "durable_observed_lower_bound": 57183,
    "received": 57183,
    "sent": 56999,
    "serialized_committed": 56999,
    "serialized_committed_bytes": 59278960,
    "serialized_dropped": 0,
    "serialized_retained": 56999,
    "serialized_retained_bytes": 59278960
  },
  "drop_breakdown": [],
  "generated_at": "2026-08-09T04:06:20.679455Z",
  "git_dirty": true,
  "git_sha": "55e50f4f713102fb8825d06029351b1c0d2a2d09",
  "latency_us": {
    "ingest": {
      "p50": 12.55,
      "p95": 34.231,
      "p99": 66.93399999999967,
      "population": 56999,
      "sample_cap": 100000,
      "sample_size": 56999,
      "valid": true
    },
    "trigger_to_flush": {
      "p50": null,
      "p95": null,
      "p99": null
    },
    "write": {
      "p50": null,
      "p95": null,
      "p99": null
    }
  },
  "lifecycle": {
    "capture_exit_code": 0,
    "final_status_state": "STOPPED_CLEAN",
    "forced_shutdown": false,
    "publisher_exit_code": 0,
    "shutdown_drain_ms": 213.79661100002068,
    "startup_latency_ms": 185.566338000001,
    "status_source": "capture_log"
  },
  "machine": {
    "architecture": "x86_64",
    "gpu_recorded": false,
    "hostname_recorded": false,
    "logical_cpu_count": 24,
    "os": "Linux",
    "os_release": "6.8.0-136-generic"
  },
  "provenance": {
    "capture_command": [
      "ros2",
      "run",
      "blackbox_capture_cpp",
      "blackbox_capture",
      "--ros-args",
      "--params-file",
      "/tmp/blackboxrs-native-bench-t7tj8ngd/recorder.yaml"
    ],
    "failure_injection": {
      "expect_storage_fault": false,
      "fail_after_bytes": -1,
      "writer_delay_ms": 0
    },
    "generated_recorder_params": true,
    "latency_clock_domain": "local_steady",
    "publisher_command": [
      "ros2",
      "run",
      "blackbox_capture_bench",
      "publisher",
      "--topics",
      "10",
      "--aggregate-rate",
      "1000.0",
      "--payload-bytes",
      "1024",
      "--duration-sec",
      "30.0",
      "--discovery-warmup-sec",
      "1.0",
      "--qos",
      "best_effort",
      "--qos-depth",
      "10",
      "--topic-prefix",
      "/blackbox_bench/topic",
      "--run-id",
      "2f6fe571e845",
      "--result-json",
      "/tmp/blackboxrs-native-bench-t7tj8ngd/publisher.json",
      "--burst-every-sec",
      "5.0",
      "--burst-duration-ms",
      "500.0",
      "--burst-multiplier",
      "10.0",
      "--churn-every-sec",
      "0.0",
      "--churn-down-ms",
      "0.0"
    ],
    "resource_process_selection": "native recorder descendant of ros2 run wrapper",
    "work_directory_retained": false
  },
  "queue": {
    "capacity": 4096,
    "depth": 0,
    "peak_depth": 134,
    "peak_utilization": 0.03271484375
  },
  "recovery": null,
  "resources": {
    "cpu_percent": {
      "max": 14.984850061845082,
      "mean": 5.864276283953493,
      "min": 1.999303688509276,
      "p50": 3.9986360298214088,
      "p95": 13.545471317227143,
      "p99": 14.69787728603343
    },
    "rss_mb": {
      "max": 49.0078125,
      "mean": 48.50768649193548,
      "min": 45.25390625,
      "p50": 48.796875,
      "p95": 49.0078125,
      "p99": 49.0078125
    }
  },
  "scenario": {
    "aggregate_rate_hz": 1000.0,
    "burst_duration_ms": 500.0,
    "burst_every_sec": 5.0,
    "burst_multiplier": 10.0,
    "churn_down_ms": 0.0,
    "churn_every_sec": 0.0,
    "duration_sec": 30.0,
    "expect_storage_fault": false,
    "fail_after_bytes": -1,
    "name": "E",
    "payload_bytes": 1024,
    "qos": "best_effort",
    "qos_depth": 10,
    "run_id": "2f6fe571e845",
    "shared_steady_clock_domain": true,
    "topics": 10,
    "writer_delay_injection_ms": 0
  },
  "schema_version": "blackboxrs.capture_benchmark.v1",
  "storage": {
    "bytes": 62313487,
    "bytes_per_second": 2077116.2333333334,
    "errors": 0,
    "partial_bytes": 0,
    "partial_segments": 0,
    "retained_bytes": 62313487,
    "retention_evicted_bytes": 0,
    "retention_evicted_segments": 0,
    "segments": 7,
    "sidecars": 7
  },
  "validity": {
    "errors": [],
    "latency_reason": "publisher steady timestamp to recorder callback steady timestamp",
    "publisher_and_capture_workload_matched": true,
    "publisher_to_callback_latency_valid": true,
    "valid": true,
    "warnings": []
  }
}
